{
  "dia": [
    {
      "servico": "Emitir guia de licenciamento anual",
      "orgaoSigla": "DETRAN",
      "path": "/transito-e-transportes/emitir-guia-de-licenciamento-anual100",
      "visitas": 307
    },
    {
      "servico": "Solicitar carteira de identidade",
      "orgaoSigla": "CGP",
      "path": "/direitos-e-cidadania/expedicao-de-carteira-de-identidade127",
      "visitas": 280
    },
    {
      "servico": "Pesquisar viabilidade",
      "orgaoSigla": "JUCEMS",
      "path": "/empresa-industria-e-comercio/pesquisar-viabilidade198",
      "visitas": 147
    },
    {
      "servico": "e-Fazenda - cadastro",
      "orgaoSigla": "SEFAZ MS",
      "path": "/financas-e-impostos/portal-e-fazenda-cadastro135",
      "visitas": 123
    },
    {
      "servico": "Emitir certidão simplificada digital",
      "orgaoSigla": "JUCEMS",
      "path": "/empresa-industria-e-comercio/emitir-certidao-simplificada-digital84",
      "visitas": 107
    },
    {
      "servico": "Certidão tributária estadual - emissão (certidão negativa de débitos estaduais)",
      "orgaoSigla": "SEFAZ MS",
      "path": "/financas-e-impostos/certidao-tributaria-estadual-emissao152",
      "visitas": 95
    },
    {
      "servico": "IPVA - consulta de débito",
      "orgaoSigla": "SEFAZ MS",
      "path": "/financas-e-impostos/ipva-consulta-de-debito54",
      "visitas": 92
    },
    {
      "servico": "Registrar boletim de ocorrências on-line",
      "orgaoSigla": "PCMS",
      "path": "/seguranca/delegacia-virtual-devir105",
      "visitas": 88
    },
    {
      "servico": "IPVA ou LICENCIAMENTO - emitir boleto",
      "orgaoSigla": "PGE MS",
      "path": "/financas-e-impostos/pagamento-de-ipva-inscrito-em-divida-ativa134",
      "visitas": 86
    },
    {
      "servico": "IPVA - troca de veículo - redução para pessoa com deficiência (PcD)",
      "orgaoSigla": "SEFAZ MS",
      "path": "/financas-e-impostos/ipva-troca-de-veiculo-reducao-p-pessoa-com-deficiencia-pcd39",
      "visitas": 77
    },
    {
      "servico": "Emitir certidão de antecedentes criminais",
      "orgaoSigla": "CGP",
      "path": "/seguranca/expedicao-de-certidao-de-antecedentes-criminais35",
      "visitas": 63
    },
    {
      "servico": "Emitir certidão de inteiro teor digital",
      "orgaoSigla": "JUCEMS",
      "path": "/empresa-industria-e-comercio/certidao-de-inteiro-teor-digital19",
      "visitas": 58
    },
    {
      "servico": "Documento de arrecadação do estado de Mato Grosso do Sul (DAEMS) - emissão",
      "orgaoSigla": "SEFAZ MS",
      "path": "/financas-e-impostos/documento-de-arrecadacao-do-estado-de-mato-grosso-do-sul-daems-emissao5",
      "visitas": 52
    },
    {
      "servico": "Solicitar Carteira de Visitante do Sistema Prisional",
      "orgaoSigla": "AGEPEN",
      "path": "/direitos-e-cidadania/patronato138",
      "visitas": 47
    },
    {
      "servico": "Emitir boleto para pagamento de IPVA ou licenciamento de veículos em Dívida Ativa",
      "orgaoSigla": "PGE MS",
      "path": "/financas-e-impostos/emitir-boleto-para-pagamento-de-ipva-ou-licenciamento-de-veiculos-em-divida-ativa158",
      "visitas": 45
    }
  ],
  "semana": [
    {
      "servico": "Emitir guia de licenciamento anual",
      "orgaoSigla": "DETRAN",
      "path": "/transito-e-transportes/emitir-guia-de-licenciamento-anual100",
      "visitas": 1972
    },
    {
      "servico": "Solicitar carteira de identidade",
      "orgaoSigla": "CGP",
      "path": "/direitos-e-cidadania/expedicao-de-carteira-de-identidade127",
      "visitas": 1663
    },
    {
      "servico": "Registrar boletim de ocorrências on-line",
      "orgaoSigla": "PCMS",
      "path": "/seguranca/delegacia-virtual-devir105",
      "visitas": 688
    },
    {
      "servico": "Pesquisar viabilidade",
      "orgaoSigla": "JUCEMS",
      "path": "/empresa-industria-e-comercio/pesquisar-viabilidade198",
      "visitas": 639
    },
    {
      "servico": "IPVA - consulta de débito",
      "orgaoSigla": "SEFAZ MS",
      "path": "/financas-e-impostos/ipva-consulta-de-debito54",
      "visitas": 610
    },
    {
      "servico": "IPVA ou LICENCIAMENTO - emitir boleto",
      "orgaoSigla": "PGE MS",
      "path": "/financas-e-impostos/pagamento-de-ipva-inscrito-em-divida-ativa134",
      "visitas": 582
    },
    {
      "servico": "e-Fazenda - cadastro",
      "orgaoSigla": "SEFAZ MS",
      "path": "/financas-e-impostos/portal-e-fazenda-cadastro135",
      "visitas": 579
    },
    {
      "servico": "IPVA - troca de veículo - redução para pessoa com deficiência (PcD)",
      "orgaoSigla": "SEFAZ MS",
      "path": "/financas-e-impostos/ipva-troca-de-veiculo-reducao-p-pessoa-com-deficiencia-pcd39",
      "visitas": 483
    },
    {
      "servico": "Emitir certidão simplificada digital",
      "orgaoSigla": "JUCEMS",
      "path": "/empresa-industria-e-comercio/emitir-certidao-simplificada-digital84",
      "visitas": 428
    },
    {
      "servico": "Emitir certidão de antecedentes criminais",
      "orgaoSigla": "CGP",
      "path": "/seguranca/expedicao-de-certidao-de-antecedentes-criminais35",
      "visitas": 368
    },
    {
      "servico": "Certidão tributária estadual - emissão (certidão negativa de débitos estaduais)",
      "orgaoSigla": "SEFAZ MS",
      "path": "/financas-e-impostos/certidao-tributaria-estadual-emissao152",
      "visitas": 321
    },
    {
      "servico": "Solicitar Carteira de Visitante do Sistema Prisional",
      "orgaoSigla": "AGEPEN",
      "path": "/direitos-e-cidadania/patronato138",
      "visitas": 284
    },
    {
      "servico": "Consultar vagas de emprego",
      "orgaoSigla": "FUNTRAB",
      "path": "/trabalho-emprego-e-previdencia/anunciar-vagas-de-emprego-no-sine-sistema-nacional-de-emprego71",
      "visitas": 282
    },
    {
      "servico": "Emitir boleto para pagamento de IPVA ou licenciamento de veículos em Dívida Ativa",
      "orgaoSigla": "PGE MS",
      "path": "/financas-e-impostos/emitir-boleto-para-pagamento-de-ipva-ou-licenciamento-de-veiculos-em-divida-ativa158",
      "visitas": 281
    },
    {
      "servico": "Falar com a Glória",
      "orgaoSigla": "DETRAN",
      "path": "/comunicacao-e-transparencia/falar-com-a-gloria167",
      "visitas": 261
    }
  ],
  "mes": [
    {
      "servico": "Emitir guia de licenciamento anual",
      "orgaoSigla": "DETRAN",
      "path": "/transito-e-transportes/emitir-guia-de-licenciamento-anual100",
      "visitas": 7612
    },
    {
      "servico": "Solicitar carteira de identidade",
      "orgaoSigla": "CGP",
      "path": "/direitos-e-cidadania/expedicao-de-carteira-de-identidade127",
      "visitas": 6758
    },
    {
      "servico": "IPVA - consulta de débito",
      "orgaoSigla": "SEFAZ MS",
      "path": "/financas-e-impostos/ipva-consulta-de-debito54",
      "visitas": 2454
    },
    {
      "servico": "Pesquisar viabilidade",
      "orgaoSigla": "JUCEMS",
      "path": "/empresa-industria-e-comercio/pesquisar-viabilidade198",
      "visitas": 2418
    },
    {
      "servico": "e-Fazenda - cadastro",
      "orgaoSigla": "SEFAZ MS",
      "path": "/financas-e-impostos/portal-e-fazenda-cadastro135",
      "visitas": 2290
    },
    {
      "servico": "Registrar boletim de ocorrências on-line",
      "orgaoSigla": "PCMS",
      "path": "/seguranca/delegacia-virtual-devir105",
      "visitas": 2170
    },
    {
      "servico": "IPVA ou LICENCIAMENTO - emitir boleto",
      "orgaoSigla": "PGE MS",
      "path": "/financas-e-impostos/pagamento-de-ipva-inscrito-em-divida-ativa134",
      "visitas": 1900
    },
    {
      "servico": "IPVA - troca de veículo - redução para pessoa com deficiência (PcD)",
      "orgaoSigla": "SEFAZ MS",
      "path": "/financas-e-impostos/ipva-troca-de-veiculo-reducao-p-pessoa-com-deficiencia-pcd39",
      "visitas": 1620
    },
    {
      "servico": "Emitir certidão simplificada digital",
      "orgaoSigla": "JUCEMS",
      "path": "/empresa-industria-e-comercio/emitir-certidao-simplificada-digital84",
      "visitas": 1597
    },
    {
      "servico": "Emitir certidão de antecedentes criminais",
      "orgaoSigla": "CGP",
      "path": "/seguranca/expedicao-de-certidao-de-antecedentes-criminais35",
      "visitas": 1482
    },
    {
      "servico": "Certidão tributária estadual - emissão (certidão negativa de débitos estaduais)",
      "orgaoSigla": "SEFAZ MS",
      "path": "/financas-e-impostos/certidao-tributaria-estadual-emissao152",
      "visitas": 1403
    },
    {
      "servico": "Falar com a Glória",
      "orgaoSigla": "DETRAN",
      "path": "/comunicacao-e-transparencia/falar-com-a-gloria167",
      "visitas": 1086
    },
    {
      "servico": "Solicitar Carteira de Visitante do Sistema Prisional",
      "orgaoSigla": "AGEPEN",
      "path": "/direitos-e-cidadania/patronato138",
      "visitas": 1075
    },
    {
      "servico": "Emitir certidão de inteiro teor digital",
      "orgaoSigla": "JUCEMS",
      "path": "/empresa-industria-e-comercio/certidao-de-inteiro-teor-digital19",
      "visitas": 968
    },
    {
      "servico": "Emitir boleto para pagamento de IPVA ou licenciamento de veículos em Dívida Ativa",
      "orgaoSigla": "PGE MS",
      "path": "/financas-e-impostos/emitir-boleto-para-pagamento-de-ipva-ou-licenciamento-de-veiculos-em-divida-ativa158",
      "visitas": 956
    }
  ],
  "ano": [
    {
      "servico": "Emitir guia de licenciamento anual",
      "orgaoSigla": "DETRAN",
      "path": "/transito-e-transportes/emitir-guia-de-licenciamento-anual100",
      "visitas": 166609
    },
    {
      "servico": "Solicitar carteira de identidade",
      "orgaoSigla": "CGP",
      "path": "/direitos-e-cidadania/expedicao-de-carteira-de-identidade127",
      "visitas": 117699
    },
    {
      "servico": "IPVA - consulta de débito",
      "orgaoSigla": "SEFAZ MS",
      "path": "/financas-e-impostos/ipva-consulta-de-debito54",
      "visitas": 81913
    },
    {
      "servico": "e-Fazenda - cadastro",